{
  "schema_version": "1.0.0",
  "registry_id": "PLAY-ALIGNMENT-PRESETS-NFL-FIDOS",
  "coordinate_system": {"width": 100, "height": 53, "line_of_scrimmage_y": 26.5},
  "presets": [
    {"term":"shotgun_2x2","unit":"offense","category":"formation","ball":{"hash":"middle","x":50,"y":26.5},"slots":[{"key":"X","position":"WR","role":"X","x":9,"y":32},{"key":"H","position":"WR","role":"H","x":27,"y":34},{"key":"LT","position":"LT","role":"LT","x":38,"y":32},{"key":"LG","position":"LG","role":"LG","x":44,"y":32},{"key":"C","position":"C","role":"C","x":50,"y":32},{"key":"RG","position":"RG","role":"RG","x":56,"y":32},{"key":"RT","position":"RT","role":"RT","x":62,"y":32},{"key":"Y","position":"TE","role":"Y","x":73,"y":34},{"key":"Z","position":"WR","role":"Z","x":91,"y":32},{"key":"QB","position":"QB","role":"QB","x":50,"y":38},{"key":"RB","position":"RB","role":"RB","x":57,"y":43}]},
    {"term":"shotgun_trips","unit":"offense","category":"formation","ball":{"hash":"middle","x":50,"y":26.5},"slots":[{"key":"X","position":"WR","role":"X","x":9,"y":32},{"key":"LT","position":"LT","role":"LT","x":38,"y":32},{"key":"LG","position":"LG","role":"LG","x":44,"y":32},{"key":"C","position":"C","role":"C","x":50,"y":32},{"key":"RG","position":"RG","role":"RG","x":56,"y":32},{"key":"RT","position":"RT","role":"RT","x":62,"y":32},{"key":"Y","position":"TE","role":"Y","x":73,"y":34},{"key":"H","position":"WR","role":"H","x":82,"y":35},{"key":"Z","position":"WR","role":"Z","x":92,"y":32},{"key":"QB","position":"QB","role":"QB","x":50,"y":38},{"key":"RB","position":"RB","role":"RB","x":57,"y":43}]},
    {"term":"shotgun_empty","unit":"offense","category":"formation","ball":{"hash":"middle","x":50,"y":26.5},"slots":[{"key":"X","position":"WR","role":"X","x":7,"y":32},{"key":"H","position":"WR","role":"H","x":24,"y":34},{"key":"RB","position":"WR","role":"F","x":34,"y":35},{"key":"LT","position":"LT","role":"LT","x":38,"y":32},{"key":"LG","position":"LG","role":"LG","x":44,"y":32},{"key":"C","position":"C","role":"C","x":50,"y":32},{"key":"RG","position":"RG","role":"RG","x":56,"y":32},{"key":"RT","position":"RT","role":"RT","x":62,"y":32},{"key":"Y","position":"TE","role":"Y","x":76,"y":34},{"key":"Z","position":"WR","role":"Z","x":93,"y":32},{"key":"QB","position":"QB","role":"QB","x":50,"y":38}]},
    {"term":"pistol","unit":"offense","category":"formation","ball":{"hash":"middle","x":50,"y":26.5},"slots":[{"key":"X","position":"WR","role":"X","x":9,"y":32},{"key":"H","position":"WR","role":"H","x":27,"y":34},{"key":"LT","position":"LT","role":"LT","x":38,"y":32},{"key":"LG","position":"LG","role":"LG","x":44,"y":32},{"key":"C","position":"C","role":"C","x":50,"y":32},{"key":"RG","position":"RG","role":"RG","x":56,"y":32},{"key":"RT","position":"RT","role":"RT","x":62,"y":32},{"key":"Y","position":"TE","role":"Y","x":73,"y":32},{"key":"Z","position":"WR","role":"Z","x":91,"y":32},{"key":"QB","position":"QB","role":"QB","x":50,"y":37},{"key":"RB","position":"RB","role":"RB","x":50,"y":44}]},
    {"term":"i_formation","unit":"offense","category":"formation","ball":{"hash":"middle","x":50,"y":26.5},"slots":[{"key":"X","position":"WR","role":"X","x":9,"y":32},{"key":"LT","position":"LT","role":"LT","x":38,"y":32},{"key":"LG","position":"LG","role":"LG","x":44,"y":32},{"key":"C","position":"C","role":"C","x":50,"y":32},{"key":"RG","position":"RG","role":"RG","x":56,"y":32},{"key":"RT","position":"RT","role":"RT","x":62,"y":32},{"key":"Y","position":"TE","role":"Y","x":70,"y":31},{"key":"Z","position":"WR","role":"Z","x":91,"y":32},{"key":"QB","position":"QB","role":"QB","x":50,"y":35},{"key":"H","position":"FB","role":"FB","x":50,"y":39},{"key":"RB","position":"RB","role":"TB","x":50,"y":45}]},
    {"term":"ace_12","unit":"offense","category":"formation","ball":{"hash":"middle","x":50,"y":26.5},"slots":[{"key":"X","position":"WR","role":"X","x":9,"y":32},{"key":"H","position":"TE","role":"U","x":30,"y":31},{"key":"LT","position":"LT","role":"LT","x":38,"y":32},{"key":"LG","position":"LG","role":"LG","x":44,"y":32},{"key":"C","position":"C","role":"C","x":50,"y":32},{"key":"RG","position":"RG","role":"RG","x":56,"y":32},{"key":"RT","position":"RT","role":"RT","x":62,"y":32},{"key":"Y","position":"TE","role":"Y","x":70,"y":31},{"key":"Z","position":"WR","role":"Z","x":91,"y":32},{"key":"QB","position":"QB","role":"QB","x":50,"y":36},{"key":"RB","position":"RB","role":"RB","x":56,"y":41}]},
    {"term":"bunch","unit":"offense","category":"formation","ball":{"hash":"middle","x":50,"y":26.5},"slots":[{"key":"X","position":"WR","role":"X","x":9,"y":32},{"key":"LT","position":"LT","role":"LT","x":38,"y":32},{"key":"LG","position":"LG","role":"LG","x":44,"y":32},{"key":"C","position":"C","role":"C","x":50,"y":32},{"key":"RG","position":"RG","role":"RG","x":56,"y":32},{"key":"RT","position":"RT","role":"RT","x":62,"y":32},{"key":"Y","position":"TE","role":"Y","x":78,"y":33},{"key":"H","position":"WR","role":"H","x":84,"y":36},{"key":"Z","position":"WR","role":"Z","x":89,"y":32},{"key":"QB","position":"QB","role":"QB","x":50,"y":38},{"key":"RB","position":"RB","role":"RB","x":57,"y":43}]},
    {"term":"stack","unit":"offense","category":"formation","ball":{"hash":"middle","x":50,"y":26.5},"slots":[{"key":"X","position":"WR","role":"X","x":9,"y":32},{"key":"H","position":"WR","role":"H","x":13,"y":36},{"key":"LT","position":"LT","role":"LT","x":38,"y":32},{"key":"LG","position":"LG","role":"LG","x":44,"y":32},{"key":"C","position":"C","role":"C","x":50,"y":32},{"key":"RG","position":"RG","role":"RG","x":56,"y":32},{"key":"RT","position":"RT","role":"RT","x":62,"y":32},{"key":"Y","position":"TE","role":"Y","x":87,"y":36},{"key":"Z","position":"WR","role":"Z","x":91,"y":32},{"key":"QB","position":"QB","role":"QB","x":50,"y":38},{"key":"RB","position":"RB","role":"RB","x":57,"y":43}]},
    {"term":"condensed","unit":"offense","category":"formation","ball":{"hash":"middle","x":50,"y":26.5},"slots":[{"key":"X","position":"WR","role":"X","x":24,"y":32},{"key":"H","position":"WR","role":"H","x":32,"y":35},{"key":"LT","position":"LT","role":"LT","x":38,"y":32},{"key":"LG","position":"LG","role":"LG","x":44,"y":32},{"key":"C","position":"C","role":"C","x":50,"y":32},{"key":"RG","position":"RG","role":"RG","x":56,"y":32},{"key":"RT","position":"RT","role":"RT","x":62,"y":32},{"key":"Y","position":"TE","role":"Y","x":68,"y":35},{"key":"Z","position":"WR","role":"Z","x":76,"y":32},{"key":"QB","position":"QB","role":"QB","x":50,"y":38},{"key":"RB","position":"RB","role":"RB","x":57,"y":43}]},
    {"term":"4-2-5_over","unit":"defense","category":"front","ball":{"hash":"middle","x":50,"y":26.5},"slots":[{"key":"DE-L","position":"DE","role":"EDGE","x":35,"y":22},{"key":"DT-L","position":"DT","role":"3T","x":43,"y":22},{"key":"DT-R","position":"NT","role":"1T","x":53,"y":22},{"key":"DE-R","position":"DE","role":"EDGE","x":61,"y":22},{"key":"MLB","position":"LB","role":"MIKE","x":47,"y":16},{"key":"WLB","position":"LB","role":"WILL","x":57,"y":16},{"key":"NB","position":"NB","role":"NICKEL","x":27,"y":15},{"key":"CB-L","position":"CB","role":"CB","x":10,"y":21},{"key":"CB-R","position":"CB","role":"CB","x":89,"y":21},{"key":"SS","position":"S","role":"SS","x":69,"y":10},{"key":"FS","position":"S","role":"FS","x":49,"y":6}]},
    {"term":"3-4_odd","unit":"defense","category":"front","ball":{"hash":"middle","x":50,"y":26.5},"slots":[{"key":"DE-L","position":"DE","role":"4I","x":42,"y":22},{"key":"DT-L","position":"NT","role":"0T","x":50,"y":22},{"key":"DT-R","position":"DE","role":"4I","x":58,"y":22},{"key":"DE-R","position":"OLB","role":"SAM","x":66,"y":18},{"key":"NB","position":"OLB","role":"JACK","x":34,"y":18},{"key":"MLB","position":"ILB","role":"MIKE","x":46,"y":15},{"key":"WLB","position":"ILB","role":"WILL","x":55,"y":15},{"key":"CB-L","position":"CB","role":"CB","x":10,"y":21},{"key":"CB-R","position":"CB","role":"CB","x":90,"y":21},{"key":"SS","position":"S","role":"SS","x":68,"y":9},{"key":"FS","position":"S","role":"FS","x":48,"y":6}]},
    {"term":"bear","unit":"defense","category":"front","ball":{"hash":"middle","x":50,"y":26.5},"slots":[{"key":"DE-L","position":"DE","role":"5T","x":36,"y":22},{"key":"DT-L","position":"DT","role":"3T","x":44,"y":22},{"key":"DT-R","position":"NT","role":"0T","x":50,"y":22},{"key":"DE-R","position":"DT","role":"3T","x":56,"y":22},{"key":"NB","position":"EDGE","role":"5T","x":64,"y":22},{"key":"MLB","position":"LB","role":"MIKE","x":46,"y":15},{"key":"WLB","position":"LB","role":"WILL","x":56,"y":15},{"key":"CB-L","position":"CB","role":"CB","x":10,"y":21},{"key":"CB-R","position":"CB","role":"CB","x":90,"y":21},{"key":"SS","position":"S","role":"SS","x":69,"y":9},{"key":"FS","position":"S","role":"FS","x":49,"y":6}]},
    {"term":"tite","unit":"defense","category":"front","ball":{"hash":"middle","x":50,"y":26.5},"slots":[{"key":"DE-L","position":"DE","role":"4I","x":42,"y":22},{"key":"DT-L","position":"NT","role":"0T","x":50,"y":22},{"key":"DT-R","position":"DE","role":"4I","x":58,"y":22},{"key":"DE-R","position":"OLB","role":"APEX","x":68,"y":17},{"key":"NB","position":"NB","role":"APEX","x":32,"y":17},{"key":"MLB","position":"LB","role":"MIKE","x":46,"y":15},{"key":"WLB","position":"LB","role":"WILL","x":55,"y":15},{"key":"CB-L","position":"CB","role":"CB","x":10,"y":21},{"key":"CB-R","position":"CB","role":"CB","x":90,"y":21},{"key":"SS","position":"S","role":"SS","x":69,"y":9},{"key":"FS","position":"S","role":"FS","x":49,"y":6}]},